{
  "schema_version": 1,
  "id": "sample-author",
  "display_name": "Имя автора",
  "short_label": "Автор",
  "review_label": "По системе автора",
  "kind": "book_author",
  "avatar": {
    "path": "assets/reviewers/sample-author.webp",
    "license": "REPLACE_ME",
    "source": "REPLACE_ME"
  },
  "domains": [
    "editing"
  ],
  "disclaimer": "Автоматическая оценка по формализованным принципам автора, а не реальная рецензия или цитата автора."
}
