{
  "schema_version": 1,
  "id": "native",
  "display_name": "Живой русский",
  "short_label": "Native Russian",
  "review_label": "По системе живого русского",
  "kind": "project_core",
  "avatar": null,
  "domains": [
    "native_usage",
    "information_structure",
    "ellipsis",
    "contextual_economy"
  ],
  "disclaimer": "Проектная оценка естественности русского языка; не мнение конкретного человека."
}
